{"$schema":"https://json-schema.org/draft/2020-12/schema","title":"Semantic object brief v1","type":"object","required":["object_id","name","brief"],"properties":{"object_id":{"type":"string","pattern":"^[A-Za-z0-9_-]{1,100}$"},"name":{"type":"string","minLength":1},"brief":{"type":"string","minLength":1},"semantic_details":{"type":"object","additionalProperties":false,"required":["detail_budget","purpose","contents","decorations","accessories","theme"],"properties":{"detail_budget":{"type":"integer","minimum":0,"maximum":8},"purpose":{"type":"string"},"contents":{"type":"array","items":{"type":"string"}},"decorations":{"type":"array","items":{"type":"string"}},"accessories":{"type":"array","items":{"type":"string"}},"theme":{"type":"string"}}}},"additionalProperties":false}
